Unnamed: 0,site,title,date,writer,content,comments,label
18,Kronika(RO),Januárban eltűnt férfi holttestét találták meg a Szamosban,"								2022. április 11., 08:53								",MTI,"||Oroszország nem képes elismerni Ukrajna-politikájának hibáit – jelentette ki Volodimir Zelenszkij ukrán elnök vasárnap esti videóüzenetében.||„Félnek annak elismerésétől, hogy évtizedeken át helytelen álláspontot képviseltek és hatalmas forrásokat költöttek olyan emberi nullák támogatására, akiket az ukrán–orosz barátság jövendőbeli hőseivé akartak tenni” – hangoztatta Zelenszkij.| Mint mondta, Moszkva próbálkozása, hogy saját embereit juttassa hatalomra Ukrajnában, nem működött.| „Mert ezek a személyek csak abban voltak gyakorlottak, hogy saját zsebeikbe tömjék az Oroszországból kapott pénzt” – fogalmazott Zelenszkij, aki szerint a hibák eltussolására újabb hibákat követtek el, s a politikai eszközök hiányában Moszkva végül a háború megindítása mellett döntött.||Zelenszkij szerint Oroszország mindenben Ukrajnát hibáztatja.| Hozzátette, hogy eljön a nap, amikor Oroszországnak el kell ismernie az igazságot.||Dmitro Kuleba ukrán külügyminiszter közben az amerikai NBC hírtelevízió műsorában arról beszélt, hogy stratégiai hiba volt Franciaország és Németország részéről, hogy ellenezték 2008-ban Ukrajna NATO csatlakozását.| Mint mondta, ennek most látja kárát hazája.| „Ha NATO-tagok lennénk, ez a háború nem történt volna meg” – hangsúlyozta Kuleba.||Az ukrán külügyminiszter egyben azzal vádolta Németországot, hogy nem támogatja kellőképpen Ukrajnát, mert szerinte még mindig védelmi és támadó fegyverek kategóriáiban gondolkozik a fegyverzet tekintetében.| |Hozzátette, hogy Ukrajna sokkal erősebb helyzetben volna most, ha Berlin nem pazarolt volna annyi időt erre a különbségtételre.||Kuleba szerint Kijev tisztességes alkut ajánl a NATO-nak, illetve a nyugati országoknak.||– mondta az ukrán diplomácia vezetője az észak-atlanti szervezet alapokmányának 5.| cikkelyére utalva, amely kimondja, hogy ha valamelyik tagállamot támadás éri, azt a NATO egésze elleni támadásnak tekintik.| Az említett cikkely hatálya azonban nem terjed ki a nem NATO-tagállam Ukrajnára.| „Ukrajna megnyerte a Kijevért folytatott csatát.| Most egy másik ütközet közeleg, a Donbaszért folytatott csata” – fűzte hozzá Kuleba.||


Újabb tömegsírt találtak egy Kijevtől nyugatra fekvő faluban, több tucat megkínzott ember holtteste hevert egy gödörben
					Újabb tömegsírt találtak az ukrán fővárostól, Kijevtől nyugatra fekvő Buzova faluban – jelentette be Tarasz Gyidics helyi polgármester egy vasárnapi tévéműsorban.|
					

|Az ukrán sajtó hétfőre virradóra erős robbanásokról adott hírt az északkeleti Harkiv és a déli fekvésű Mikolajiv térségéből.||„Az orosz hadsereg továbbra is a kelet-ukrajnai minimáltervének megvalósításán dolgozik” – közölte hétfőre virradóra Hanna Maljar, az ukrán védelmi miniszter helyettese.| A védelmi tisztségviselő, akit az UNIAN ukrán hírügynökség idézett beszélt arról is, hogy a kijevi vezetés időközben folytatja a mozgósítást és az újoncok kiképzését.||Az ukrán vezérkar azzal számol, hogy az orosz csapatok hamarosan újabb offenzívát indítanak Kelet-Ukrajna teljes elfoglalása érdekében.| Ehhez jelenleg Oroszországból újabb alakulatok érkeznek és feltöltik a leharcolt egységeket.| A támadások súlypontjai várhatóan Harkiv és Szlovjanszk lesznek.||Ramzan Kadirov csecsen vezető hétfőre virradóra Telegram-oldalán újabb orosz offenzívát jelentett be nemcsak az ostromlott Mariupol kikötőjének elfoglalására, de Kijev és más ukrán városok ellen is.||„Először teljesen felszabadítjuk Luhanszkot és Donyecket… aztán bevesszük Kijevet és a többi várost is” – hangoztatta Kadirov, akinek alakulatai az orosz csapatok oldalán harcolnak Ukrajnában.||A The Times hétfői számában arról cikkez, hogy Svédország és Finnország már a nyáron készek lennének belépni a NATO-ba.| A brit lapnak nyilatkozó amerikai tisztségviselők szerint a két észak-európai állam NATO csatlakozása az észak-atlanti szövetség utóbbi hetekben tartott külügyminiszteri tanácskozásain beszédtéma volt.| Az üléseken Finnország és Svédország is képviseltette magát.| A The Times forrásaira hivatkozva arról ír, hogy Oroszország azzal, hogy bevonult Ukrajnába, hatalmas stratégiai hibát követett el.||


Zelenszkij ismét olajembargót követelt Oroszországgal szemben: „azonnal cselekedni kell”
					Volodimir Zelenszkij ukrán elnök ismét olajembargót követelt Oroszországgal szemben szombat esti videóüzenetében.",,0
19,Kronika(RO),"Újabb tömegsírt találtak egy Kijevtől nyugatra fekvő faluban, több tucat megkínzott ember holtteste hevert egy gödörben","								2022. április 11., 09:45								",Hírösszefoglaló,"||Januárban eltűntnek nyilvánított, 58 éves besztercei férfi holttestét halászták ki a Szamosból vasárnap a várostól több mint 40 kilométerre, Felőr község közelében – közölte hétfőn a Beszterce-Naszód megyei rendőrség.||A holttestet előbb a Sajó vizében, Kentelke térségében látták meg vasárnap délután a helyiek, négy órával később a Szamosból vitték ki a partra a tűzoltók.||A rendőrség közleménye szerint a törvényszéki orvos megállapította, hogy a holttest egy január 19-én eltűntnek nyilvánított, 58 éves férfié.| |Halálának okát a kórbonctani vizsgálat fogja feltárni.||A rendőrség gondatlanságból elkövetett emberölés gyanújával nyomoz az ügyben – írja az Agerpres.",,1
